{
  "artifactType": "review-session",
  "schemaVersion": "1.0.0",
  "reviewId": "review-20260506T191838Z",
  "status": "planned",
  "createdAt": "2026-05-06T19:18:38+00:00",
  "updatedAt": "2026-05-06T19:18:38+00:00",
  "change": {
    "changeType": "feature",
    "changedBy": "developer-engineer",
    "securityTouch": "auto",
    "baseRef": null,
    "headRef": null
  },
  "changedFiles": [
    "src/features/auth/AuthProvider.tsx"
  ],
  "statistics": {
    "totalItems": 2,
    "completedItems": 0,
    "findingCount": 0,
    "blockingFindingCount": 0
  }
}
