{
  "artifactType": "review-session",
  "schemaVersion": "1.0.0",
  "reviewId": "review-20260506T191313Z",
  "status": "completed",
  "createdAt": "2026-05-06T19:13:13+00:00",
  "updatedAt": "2026-05-06T19:13:13+00:00",
  "change": {
    "changeType": "feature",
    "changedBy": "developer-engineer",
    "securityTouch": "auto",
    "baseRef": null,
    "headRef": null
  },
  "changedFiles": [
    "src/features/chat/api.ts"
  ],
  "statistics": {
    "totalItems": 1,
    "completedItems": 1,
    "findingCount": 0,
    "blockingFindingCount": 0
  }
}
