{
  "artifactType": "review-session",
  "schemaVersion": "1.0.0",
  "reviewId": "review-20260423T002233Z",
  "status": "completed",
  "createdAt": "2026-04-23T00:22:33+00:00",
  "updatedAt": "2026-04-23T00:22:33+00:00",
  "change": {
    "changeType": "bug-fix",
    "changedBy": "developer-engineer",
    "securityTouch": "no",
    "baseRef": null,
    "headRef": null
  },
  "changedFiles": [
    "src/features/chat/components/ChatInput.tsx"
  ],
  "statistics": {
    "totalItems": 1,
    "completedItems": 1,
    "findingCount": 0,
    "blockingFindingCount": 0
  }
}
