{
  "schemaVersion": "1.0.0",
  "status": "initialized",
  "createdAt": "2026-04-17T00:00:00+00:00",
  "updatedAt": "2026-04-17T00:00:00+00:00",
  "change": {
    "changeType": "feature",
    "changedBy": "developer-engineer",
    "securityTouch": "auto"
  },
  "changedFiles": [],
  "statistics": {
    "totalItems": 0,
    "completedItems": 0,
    "findingCount": 0,
    "blockingFindingCount": 0
  },
  "artifactType": "review-session",
  "reviewId": "review-legacy"
}
